{
  "schema_version": "1.0.0",
  "generated_at": "2026-07-21T00:00:00+10:00",
  "source_denominator": {
    "inventoried": 2,
    "processed": 2,
    "pending": 0,
    "inaccessible": 0
  },
  "records": [
    {
      "record_id": "XHR-0001",
      "source_pointer": "file_library:xrp tracking cont.txt:master-continuity-layer",
      "source_date": "2026-07-17",
      "asset_class": "xrp",
      "assets": ["XRP", "Ripple", "XRPL", "RLUSD"],
      "record_type": "instruction",
      "verbatim_request": "Build and maintain the most complete, current, structured XRP tracking system possible for XRP's trajectory from current price levels to all milestone prices, including the extreme tail scenario of $10,000.",
      "verbatim_response": null,
      "normalized_requirement": "Maintain an additions-only, full-refresh XRP trajectory system covering all milestone bands and the $10,000 tail scenario without silently discarding prior logic.",
      "authority_tier": "user_request",
      "adoption_state": "adopted",
      "supersedes": [],
      "conflicts_with": [],
      "verification_state": "source_verified",
      "historical_values": {
        "price_target": 10000,
        "probability_percent": null,
        "impact_percent": null,
        "time_horizon": null,
        "currency": "USD"
      },
      "canonical_placement": "services/xrp-hbar-apex/spec/tracking-system/xrp-master-continuity",
      "module_owner": "xrp-hbar-apex",
      "workflow_id": "XRP-UPDATE-DEEP-SCAN",
      "artifact_path": "registry/xrp-hbar-cross-asset-historical-reconciliation-matrix.json",
      "test_or_waiver": "Schema validation required",
      "evidence_ref": "file_library:xrp tracking cont.txt",
      "rollback_ref": "Revert tranche commit",
      "notes": "Bounded first tranche; not a full historical denominator."
    },
    {
      "record_id": "XHR-0002",
      "source_pointer": "file_library:xrp tracking cont.txt:probability-separation",
      "source_date": "2026-07-17",
      "asset_class": "xrp",
      "assets": ["XRP"],
      "record_type": "probability",
      "verbatim_request": null,
      "verbatim_response": "Keep two types of numbers in the snapshots: Unconditional probability and Scenario-consistency score.",
      "normalized_requirement": "Never combine unconditional probability, scenario-consistency score and trigger-activation score; show each separately.",
      "authority_tier": "assistant_proposal",
      "adoption_state": "adopted",
      "supersedes": ["legacy-94-percent-as-unconditional"],
      "conflicts_with": ["legacy-94-percent-as-unconditional"],
      "verification_state": "source_verified",
      "historical_values": {
        "price_target": 10000,
        "probability_percent": null,
        "impact_percent": null,
        "time_horizon": "long-term tail",
        "currency": "USD"
      },
      "canonical_placement": "services/xrp-hbar-apex/spec/forecasting/probability-separation",
      "module_owner": "forecast-engine",
      "workflow_id": "FORECAST-TRUTH-GATE",
      "artifact_path": null,
      "test_or_waiver": "Forecast output contract test pending",
      "evidence_ref": "file_library:xrp tracking cont.txt",
      "rollback_ref": "Restore prior record while preserving conflict history",
      "notes": "Corrects the historical ambiguity where a scenario score near 94% was presented like a real-world probability."
    },
    {
      "record_id": "XHR-0003",
      "source_pointer": "file_library:xrp tracking cont.txt:legacy-94-percent",
      "source_date": null,
      "asset_class": "xrp",
      "assets": ["XRP"],
      "record_type": "probability",
      "verbatim_request": "No, you used to show much higher close to 94% probability of a $10,000 at one stage, do you remember?",
      "verbatim_response": null,
      "normalized_requirement": "Preserve the historic near-94% figure as lineage, but classify it as a scenario/trigger-alignment metric unless primary evidence proves it was an unconditional probability.",
      "authority_tier": "user_correction",
      "adoption_state": "superseded",
      "supersedes": [],
      "conflicts_with": ["XHR-0002"],
      "verification_state": "source_verified",
      "historical_values": {
        "price_target": 10000,
        "probability_percent": 94,
        "impact_percent": null,
        "time_horizon": null,
        "currency": "USD"
      },
      "canonical_placement": "services/xrp-hbar-apex/history/forecast-conflicts",
      "module_owner": "discrepancy-engine",
      "workflow_id": "HISTORICAL-PROBABILITY-RECONCILIATION",
      "artifact_path": null,
      "test_or_waiver": "Source-context reconstruction pending",
      "evidence_ref": "file_library:xrp tracking cont.txt",
      "rollback_ref": "Do not delete; change classification only with stronger evidence",
      "notes": "Historical value retained rather than erased."
    },
    {
      "record_id": "XHR-0004",
      "source_pointer": "file_library:xrp tracking cont.txt:milestone-bands",
      "source_date": "2026-07-17",
      "asset_class": "xrp",
      "assets": ["XRP"],
      "record_type": "table",
      "verbatim_request": null,
      "verbatim_response": "Track and update $3, $5, $10, $20, $50, $100, $150, $500, $1,000 and $10,000.",
      "normalized_requirement": "Maintain milestone records for $3, $5, $10, $20, $50, $100, $150, $500, $1,000 and $10,000 with probability, scenario score, timing, triggers, missing conditions, upside and downside.",
      "authority_tier": "assistant_proposal",
      "adoption_state": "adopted",
      "supersedes": [],
      "conflicts_with": [],
      "verification_state": "source_verified",
      "historical_values": {
        "price_target": "$3/$5/$10/$20/$50/$100/$150/$500/$1,000/$10,000",
        "probability_percent": null,
        "impact_percent": null,
        "time_horizon": "multi-horizon",
        "currency": "USD"
      },
      "canonical_placement": "services/xrp-hbar-apex/registry/milestone-bands",
      "module_owner": "forecast-engine",
      "workflow_id": "MILESTONE-RECALCULATION",
      "artifact_path": null,
      "test_or_waiver": "Milestone completeness test pending",
      "evidence_ref": "file_library:xrp tracking cont.txt",
      "rollback_ref": "Version prior milestone registry",
      "notes": null
    },
    {
      "record_id": "XHR-0005",
      "source_pointer": "file_library:xrp tracking cont.txt:direct-demand-rule",
      "source_date": "2026-07-17",
      "asset_class": "xrp",
      "assets": ["XRP", "Ripple", "XRPL", "RLUSD"],
      "record_type": "instruction",
      "verbatim_request": null,
      "verbatim_response": "Ripple/XRPL success does not automatically equal XRP token demand.",
      "normalized_requirement": "For every adoption claim, map the capital-flow pathway and distinguish Ripple equity, software, RLUSD, private-ledger and XRPL activity from direct XRP holding or transaction demand.",
      "authority_tier": "assistant_proposal",
      "adoption_state": "adopted",
      "supersedes": ["adoption-equals-token-demand"],
      "conflicts_with": ["adoption-equals-token-demand"],
      "verification_state": "source_verified",
      "historical_values": {
        "price_target": null,
        "probability_percent": null,
        "impact_percent": null,
        "time_horizon": null,
        "currency": null
      },
      "canonical_placement": "services/xrp-hbar-apex/spec/direct-demand-model",
      "module_owner": "direct-demand-engine",
      "workflow_id": "CLAIM-TO-CAPITAL-FLOW",
      "artifact_path": null,
      "test_or_waiver": "Direct-demand classification tests pending",
      "evidence_ref": "file_library:xrp tracking cont.txt",
      "rollback_ref": "Restore prior classification with discrepancy entry",
      "notes": "Core anti-hype truth control."
    },
    {
      "record_id": "XHR-0006",
      "source_pointer": "file_library:xrp tracking cont.txt:update-trigger",
      "source_date": "2026-07-17",
      "asset_class": "xrp",
      "assets": ["XRP", "Ripple", "XRPL", "RLUSD"],
      "record_type": "workflow",
      "verbatim_request": "Update / deep scan XRP tracking system",
      "verbatim_response": null,
      "normalized_requirement": "UPDATE and DEEP SCAN must refresh the full visible-scope system, add newly found evidence, recalculate milestones and triggers, update discrepancies and preserve prior versions.",
      "authority_tier": "user_request",
      "adoption_state": "adopted",
      "supersedes": [],
      "conflicts_with": [],
      "verification_state": "source_verified",
      "historical_values": {
        "price_target": null,
        "probability_percent": null,
        "impact_percent": null,
        "time_horizon": "on demand",
        "currency": null
      },
      "canonical_placement": "services/xrp-hbar-apex/workflows/update-deep-scan",
      "module_owner": "orchestrator",
      "workflow_id": "XRP-UPDATE-DEEP-SCAN",
      "artifact_path": null,
      "test_or_waiver": "Trigger routing test pending",
      "evidence_ref": "file_library:xrp tracking cont.txt",
      "rollback_ref": "Revert workflow version",
      "notes": "Does not claim hidden continuous background execution."
    },
    {
      "record_id": "XHR-0007",
      "source_pointer": "file_library:Pasted markdown.md:XRP-HBAR-Apex-addition",
      "source_date": "2026-07-17",
      "asset_class": "cross_asset",
      "assets": ["XRP", "Ripple", "HBAR", "Hedera"],
      "record_type": "instruction",
      "verbatim_request": "Always separate network or software adoption from direct XRP/HBAR token demand.",
      "verbatim_response": null,
      "normalized_requirement": "Apply the direct-demand and capital-flow truth gate to both XRP/Ripple and HBAR/Hedera analysis.",
      "authority_tier": "user_request",
      "adoption_state": "adopted",
      "supersedes": [],
      "conflicts_with": [],
      "verification_state": "source_verified",
      "historical_values": {